page;item_news
17;«ГАЗель» столкнулась с легковушкой в Воронежской области
17;Из-за ямы в Воронеже перекрыли часть улицы
17;С начала июля в Воронеже выпало почти 200% от нормы осадков
17;Когда восстановят сгоревшие Воронежские леса?
17;Занести в дом легко, а избавиться — нет: кожееды
17;Дагестанцам, жестоко избившим воронежца в метро, могут смягчить статью
17;Крупный воронежский гипермаркет оштрафовали за неправильное хранение мяса
17;В Воронежской области участковый в свой выходной задержал обидчика пенсионера
17;27 июля: Стефанов день. Что можно и чего категорически нельзя сегодня делать
17;На легендарного воронежского следователя пожаловались Бастрыкину
17;Скончалась доцент факультета прикладной математики ВГУ
17;Прогноз погоды в Воронеже на среду, 27 июля
18;«Мы по поводу проститутки». Воронежанка, не оплатившая наращивание ресниц, подверглась травле
18;Стало известно, кто стал Мисс Россия в этом году
18;Подробный гороскоп для всех знаков зодиака на среду, 27 июля
18;Воронежские врачи спасли 4-летнего мальчика с опасной формой пневмонии
18;Билеты на матч «Факел» — «Динамо» в кассы стадиона так и не поступят
18;Антимонопольщики наказали воронежских энергетиков за необоснованную разницу в ценах
18;В Воронеже 60-летняя женщина ушла из дома и пропала без вести
18;Воронежского полицейского поймали на получении взятки от мошенника
18;Задержанный скончался в отделе полиции в Воронеже
18;В Воронеже наркоман приставил к горлу своей матери нож, требуя денег
18;Не просто огурцы: салаты на зиму
18;Воронежцы нашли раненого аиста в огороде
18;Мэр Воронежа держит на контроле ход работ на Петровской набережной
18;Левый берег затянуло чёрным дымом (ВИДЕО)
18;Сделанное не по ГОСТу масло выявили у воронежского производителя
18;Скончался один из пострадавших в результате атаки квадрокоптера в Брянской области
18;В британский санкционный список попал губернатор Воронежской области
18;Как типичное ДТП вызвало небывалую волну народного гнева
18;Стало известно, где перекроют движение в центре Воронежа из-за матчей «Факела»
18;Новый мост Остужевской развязки готовят к асфальтированию
18;Почему кошки так любят хлеб?
18;Роспотребнадзор назвал опасными 19 пляжей в Воронежской области
18;Бывшего советника Воронежского губернатора обвиняют в мошенничестве
18;«Вонь аж до тошноты»: воронежец показал разноцветное водохранилище
19;4 человека пострадали в результате атаки квадрокоптера на таможенный пост в Брянской области
19;Два новых интерната для пожилых построят в Воронежской области в 2023 году
19;Грозы задержатся в Воронежской области ещё на один день
19;Как не отравиться, купив в Воронеже арбуз?
19;Авария с 2 иномарками произошла в Воронежской области: есть пострадавший
19;Скандального стендап-комика из Воронежа заподозрили в дискредитации Вооружённых сил России
19;В Воронежской области легковушка сбила велосипедиста: погиб 17-летний парень
19;В Воронежской области пропал без вести мужчина с провалами в памяти
19;Счётная палата отказалась повышать налог для богатых россиян
19;Готов ли Воронеж к возвращению большого футбола?
19;Что почитать воронежцам на этой неделе
19;Два припаркованных автомобиля сгорели ночью в Воронеже
19;Стало известно, от кого получил взятку задержанный замначальника Военно-воздушной академии
19;Будут ли в Воронеже запускать дополнительный общественный транспорт во время матчей «Факела»?
19;26 июля: Гавриил Летний. Что можно и чего категорически нельзя сегодня делать
19;«Сейчас массово освобождаются те, кто сел в 90-е. У этих людей нет рамок»
19;Прогноз погоды в Воронеже на вторник, 26 июля
19;Стало известно, сколько воронежских семей относятся к среднему классу
19;В Воронежской области женщина потратила более 3 млн рублей на биржевую торговлю
19;Подробный гороскоп для всех знаков зодиака на вторник, 26 июля
19;В Воронеже успешно испытали двигатель к отечественной ракете-носителю «Союз-5»
19;«Бассейн», «озеро», «море» и другие последствия ливня в Воронеже
19;Развод пенсионеров при ремонте бытовой техники в Воронеже
19;8-балльные пробки из-за дождя сковали Воронеж
20;Московский инспектор ДПС переплюнул воронежского гаишника с 22 квартирами
20;Нововоронежская АЭС: энергоблок № 7 выведен на 100-процентную мощность
20;В курском селе обстреляли вышку сотовой связи
20;Воронежский пенсионер выплатит штраф за дискредитацию армии РФ в соцсетях
20;Бронеавтомобиль с военнослужащими перевернулся на воронежской трассе
20;Грузовой поезд насмерть сбил девочку в Воронежской области
20;Как найти управу на соседа по даче
20;Легковушка с французскими номерами влетела в опору ЛЭП в Воронежской области
20;ВТБ провел первые сделки по ипотеке под 9,9%
20;Ситуация с ковидом в Воронеже после ухудшения стабилизировалась
20;Банду наркосбытчиков поймали в Воронеже
20;Град и грозы обрушатся на Воронежскую область
20;Соединяющий Шилово и Гремячье понтонный мост обновят за 208 млн рублей
20;Мэрия Воронежа хочет отсудить у «Городских парковок» около 2,3 млн рублей
20;Купание попугая: как и зачем это делать
20;Стало известно, кто из читателей «МОЁ! Online» получит деньги за лучшие народные новости
20;Мужчина погиб, отбиваясь вилами от стада свиней
20;Губернатор: на стройке мегашколы в Воронеже завершается цикл монолитных работ
20;Синоптики рассказали, закончатся ли в Воронеже дожди на рабочей неделе
20;В Воронежской области два человека погибли при пожаре в жилом доме
20;В Воронеже женщину увезли на скорой после поездки в маршрутке
20;В Воронежской области женщины стали чаще занимать руководящие должности
20;Жителя Воронежской области отправили на 9 лет в колонию за убийство гостя
20;1 человек погиб и 5 пострадали в столкновении двух легковушек на воронежской трассе
21;В России могут вновь появиться купюры номиналом 5 и 10 рублей
21;В Воронеже спасатели вывели из горящей многоэтажки 6 человек
21;Тельцам лучше не рубить сплеча, а Скорпионам — не жадничать
21;Воронежцам рассказали, как отменить выписанный штраф ГИБДД
21;Воронежец вышел из дома в неизвестном направлении и пропал без вести
21;25 июля: Прокл Плакальщик. Зачем в этот день варили суп на росяной воде?
21;Во втором матче в РПЛ «Факел» снова открыл счёт, но проиграл
21;Подробный гороскоп для всех знаков зодиака на понедельник, 25 июля
21;Прогноз погоды в Воронеже на понедельник, 25 июля
21;В Воронеже упавшее дерево пробило крышу припаркованной машины
21;Житель Воронежской области снял на видео плывущую по Дону косулю
21;ЛОС выплатят более 725 млн рублей за загрязнение воронежского водохранилища
21;Как бывший лётчик покорял реку Дон на подводной лодке
21;«Музей забытой музыки» — причина приехать в Воронеж № 49
21;Жители 4 районов Воронежа останутся без горячей воды на предстоящей неделе
21;«Караоке, мат и пьяные визги». Воронежский микрорайон не спит из-за вечеринок в съёмном коттедже
21;С кроликом тоже можно поиграть
21;В Воронеже женщина пообщалась с незнакомцем и лишилась более 3 млн рублей
21;Пьяный водитель врезался в иномарку на воронежской трассе: пострадали 3 человека
21;Воронежцы снова могут посетить экскурсии в Хопёрском заповеднике
21;В Воронеже ищут пропавшего без вести мужчину, приехавшего на заработки
21;На воронежской трассе опрокинулась легковушка: есть пострадавший
21;Узница концлагерей готова отдать чиновникам свою квартиру в аварийном доме
21;В тесноте, да не в обиде? Депутаты  вернули в Воронеж «точечную» застройку.
22;Учитель, задержанный за развращение мальчиков, мог сесть ещё три года назад
22;Победителям чемпионата по гребле на «драконах» вручили пряники
22;Подробный гороскоп для всех знаков зодиака на воскресенье, 24 июля
22;Прогноз погоды в Воронеже на воскресенье, 24 июля
22;«Её муж начал выбивать дверь, а она мне угрожала». Воронежанка грубо отказалась оплачивать «некрасивое» наращивание ресниц
22;«Дай пять!»: учим собаку простой и веселой команде
22;Из-за погодного апокалипсиса воронежские энергетики перешли в режим повышенной готовности
22;Мужчина и подросток сломали ворота и шлагбаум во дворе своего ЖК (ВИДЕО)
22;«Сын добрался домой, истекая кровью»
22;Туман надвигается на Воронежскую область
22;Воронежские строители прибыли на помощь жителям ЛНР
22;Воронежские полицейские разыскивают виновника ДТП, в котором пострадали двое детей
22;Власти ищут свидетелей издевательств над собакой, за которую заступается весь Воронеж
22;Андрей Платонов: «Ожидаю или доноса на себя, или кирпича на улице»
22;Хакер попал под суд за атаки на сайт правительства Воронежской области
22;ЕР: В карте «Капитальный ремонт школ» ученики смогут сами выбирать дизайн школы
22;Воронежец поймал 15-килограммового сома в водохранилище
22;Мэр сообщил о создании в Воронеже арт-кластера
22;Синоптики объяснили переменчивую погоду в Воронеже
22;После гибели 9-летней девочки в аварии с УАЗом и КамАЗом на её родственника завели дело
22;Жители воронежского микрорайона массово пожаловались на отключение света
22;Пятилетняя девочка убежала от родителей в Воронежской области
22;Стали известны подробности ДТП с «ПАЗиком» у заправки в Воронеже
22;«На головы сыпется мусор»: воронежцы рассказали о бардаке и протечках во время ремонта крыши многоэтажки
23;Отдых в отелях «все включено» в Турции в шесть раз дешевле, чем на Кубани
23;Быстрый десерт из готового теста. 3 идеальных рецепта.
23;23 июля: Антоний Громовержец. Почему в этот день опасались смотреть на свое отражение?
23;ДТП в Панино. «Все в селе знают, что в полиции хотят это дело прикрыть»
23;Ключевая ставка упала ниже предсанкционного уровня
23;Воронежцам организовали подвоз воды из-за коммунальной аварии в Коминтерновском районе
23;Прогноз погоды в Воронеже на субботу, 23 июля
23;«ПАЗик» и легковушка столкнулись у заправки в Воронеже: пострадали 5 человек
23;Воронеж вошёл в десятку рейтинга городов по IQ
23;Синоптики опровергли предупреждение о заморозках в Воронежской области
23;Подробный гороскоп для всех знаков зодиака на субботу, 23 июля
23;Гонки на «драконах» пройдут на Воронежском «море»
23;Петровскую набережную перекроют на неделю со стороны одной из улиц
23;«Наглецы из Воронежа!» Как «Факел» удивил всю футбольную Россию
23;Воронежцы пришли «поговорить по-хорошему» к мужчине, жёстко избившему свою собаку
23;«Трубы рвутся, как бумага». Очередная крупная коммунальная авария произошла в Коминтерновском районе
23;Уроженку Воронежа номинировали на премию «Эмми» за музыку к популярному сериалу от Netflix
23;Стало известно, где почти неделю пропадала 19-летняя воронежанка
23;В Воронеже на заборе появилась «летопись жизни Петра I»
23;Какой «Факел» был самым сильным в истории?
23;Чем лечат оспу обезьян и что в Воронеже с вакцинацией?
23;Стали известны даты каникул в воронежских школах в следующем учебном году
23;Подозреваемый во взятке от сутенёров экс-следователь попытался выбраться из СИЗО
23;Заморозки ожидаются в Воронежской области на выходных
24;В Ельце снимают фильм с «Невским» в главной роли
24;9-летний ребёнок погиб в столкновении УАЗа и КамАЗа в Воронежской области
24;Воронежский губернатор заявил, что регион будет обеспечен зерном с лихвой
24;Установили личность воронежца, который танцевал и пел на могилах
24;Тепло и дождь ждут воронежцев на выходных
24;Производитель сигарет Marlboro, Chesterfield и Parliament уйдёт из России
24;Как распознать кота-мышелова
24;Гипнозом пользуются мошенники, которые снимают деньги с банковских карт или выманивают их на улице
24;На воронежской трассе иномарка врезалась в ограждение из-за лопнувшего колеса, есть пострадавший
24;Пропавшего 11-летнего мальчика нашли в магазине воронежского райцентра
24;Обезьяна напала на двухлетнюю девочку и покусала её
24;«Не делаю ремонт, потому что знаю — нас будет затапливать снова и снова»
24;Губернатор: в Воронежской области могут появиться новые комплексы по переработке и утилизации отходов
24;В Нововоронеже около 1 200 свёртков с героином изъяли у двух уроженцев Средней Азии
24;В Воронежской области ВАЗ вылетел в кювет и опрокинулся: есть пострадавший
24;В одном из районов Воронежской области назначили нового прокурора
24;11-летний мальчик пропал в Воронежской области
24;Запрет на полёты в Воронежской области продлили в 25-й раз
24;Пожарная опасность в Воронежской области снизилась до минимума
24;МТС вошла в топ-3 крупнейших ИТ-компании России
24;Воронежцев предупредили об опасной икре щуки
24;«И как там утки плавают?». Воронежцы назвали водохранилище зелёным болотом
24;Как вылечить грибок на ногтях народными средствами
24;Житель Воронежской области ударил приятеля в ногу ножницами за отказ пропивать пенсию
25;22 июля: Черничный день. Что можно и чего категорически нельзя сегодня делать
25;Эксперимент «МОЁ!»: где в Воронеже можно купить арбуз без нитратов
25;Прогноз погоды в Воронеже на пятницу, 22 июля
25;Водопад на остановке и озеро у подъезда. Воронежцы рассказали о последствиях дождей
25;Юрий Лоза рассказал, кому выгодны пробки на М-4 «Дон»
25;Машину заметили на новом мосту Остужевской развязки
25;Пропавшего без вести жителя Воронежской области нашли полицейские
25;Подробный гороскоп для всех знаков зодиака на пятницу, 22 июля
25;Воронежцев предупредили о грозах и тумане
25;Второй проход через ж/д пути у Заставы заложили кирпичами
25;Бывшего режиссёра «Ералаша» отправили в колонию за педофилию
25;Дело об убийстве воронежца экс-полицейским дошло до суда
25;Отчаянный скейтбордист едва не попал под колёса воронежского автомобилиста
25;«Подвалы заливает кипятком, стены в подъезде — горячие». В Воронеже прорвало очередной водопровод
25;Воронежский «Буран» начнёт новый сезон игрой против чемпиона
25;Аналитики подсчитали индекс шаурмы для Воронежа
25;Памятник погибшему на Украине лётчику установили в воронежском райцентре
25;Воронежец заметил автомобиль с исчезающими номерами
25;«Дедушку расстреляли на глазах жены и семерых детей»
25;Мужчина выхватил ребёнка из коляски и бросился с ним под машину
25;«Советую всем слабонервным это не смотреть»: воронежец жёстко избил свою собаку
25;Воронежские власти снова борются с уличными пробками за 774 миллиона
25;В период дачного сезона и отпусков не забывайте передавать показания приборов учета!
25;Умерла сотрудница мэрии Воронежа
26;Новый тариф UP от билайна — тысячи вариантов в одном решении
26;Левый берег частично остался без воды
26;Почему аквариум полезен для ребёнка?
26;Воронежцы сообщили о сбое в работе сервисов Сбербанка
26;Физрука воронежской школы задержали за развращение двух мальчиков
