page;item_news
1;Выезд из Воронежа сковала многокилометровая пробка
1;Ржавые ливнёвки и больные деревья. Воронежцы пожаловались на состояние «Орлёнка»
1;«Никто не видел, как он ушёл под воду». Мужчина утонул на пляже в Боровом
1;Аквариум, в котором рыбки неважны
1;Неизвестные попытались устроить диверсию в Курском аэропорту
1;Семь правил безопасного отдыха в Абхазии
1;Воронежца оштрафовали за публичную критику действий Вооруженных сил РФ
1;Губернатор выделил воронежской многодетной семье 14,6 млн на жилье
1;Под Воронежем «девятку» разорвало пополам в ДТП — водитель погиб
1;Новые автобусы с кондиционерами вышли на линию в Воронеже
1;Водолазы наши тело отца, который утонул при спасении своих детей из водоворота
1;«Медперсонал, который делает прививки, отсутствует. Вот тебе и вакцинация»
1;Что хороший дачник обязательно сделает в саду в августе
1;5 советов, как не стать жертвой телефонных мошенников
1;Прогноз погоды в Воронеже на субботу, 6 августа
1;Экс-главе «Горэлектросети» Кочетову дали срок за аферу на 600 млн. И отпустили
1;В Воронеже мужчина в разгар рабочего дня обчистил сейф в магазине
1;Власти отремонтируют дорогу, которая дублирует участок М-4 «Дон»
1;Подробный гороскоп для всех знаков зодиака на субботу, 6 августа
1;Необычный стиль вождения заметили воронежцы на трассе М-4 «Дон»
1;Владимир Нетёсов оценил ход строительства умной спортивной площадки в Верхнехавском районе
1;Бесплатный фестиваль короткометражек пройдёт в Белом колодце
1;Воронежцы заметили в городе бегущую по своим делам лису
1;Эксперт рассказал, будет ли война на Балканах и при чём здесь Воронеж
2;В Семилуках во второй раз могут не состояться выборы мэра
2;Воронежские власти опровергли слухи о разбросанных по территории региона минах
2;Воронежец так сильно болел за «Факел», что получил инфаркт
2;В Воронежской области появились стада оленей. Где их можно увидеть?
2;Экологи рассказали о результатах проб воды из разноцветного воронежского водохранилища
2;Почти три десятка домов останутся без воды в Северном микрорайоне
2;Самодельный пистолет из дерева и трубок нашли у рецидивиста в Воронежской области
2;Леса в Воронежской области запретят посещать до конца лета
2;В 22 года лишилась рук и ног, спасая раненых
2;За 4 дня суточное количество заболевших ковидом воронежцев выросло почти в 2 раза
2;МегаФон: россияне заинтересовались ресейл-платформами
2;Для семи воронежских автобусных маршрутов найдут нового перевозчика
2;Стоит ли детям смотреть душераздирающие фильмы?
2;Женщина отравила трёх внуков и дочь-инвалида, накормив их молочным супом
2;На выходных в Воронеж вернётся 30-градусная жара
2;Питомцу жарко? Есть решение — костюм с вентилятором
2;В Воронеже пропала без вести 28-летняя жительница Санкт-Петербурга
2;Правда ли, что в разговоре с мошенниками достаточно одного слова «да», чтобы лишиться своих денег?
2;Бюджет «Факела» сравнили с зарплатой двух бразильских футболистов «Зенита»
2;В Воронеже ищут сбежавшего из колонии заключённого
2;КамАЗ перевернулся на дороге в Воронежской области: есть пострадавший
2;Как снизить риск развития катаракты
2;Учительница получила 5 лет условно за дискредитацию российской армии во время урока
2;В Воронежской области ожидается опасное солнце
3;Как грамотно помочь пострадавшему пока медики в дороге
3;Иномарка и мопед столкнулись в Воронежской области: пострадал 14-летний мальчик
3;Воронежцев предупредили, что в жару баловать себя пивом опасно
3;Фермер из Воронежской области незаконно присвоил грант на 800 тысяч рублей
3;В Воронеже пропал нуждающийся в медпомощи пенсионер
3;Два пляжа в Воронежской области попали в список непригодных для отдыха
3;Получат ли воронежские родители выплаты на детей к школе
3;Может ли в Воронеже повториться трагедия с фонтаном?
3;Воронежцы спасли от гибели бельчонка со сломанной лапой
3;5 августа: Трофим Бессонник. Какая ягода в этот день поможет обрести любовь?
3;Футбольные ворота упали на лицо 7-летнему мальчику в Черноземье
3;Американская белая бабочка заполонила поля в южном регионе России
3;Прогноз погоды в Воронеже на пятницу, 5 августа
3;Дочь Юрия Хоя: «Сын в восторге от того, что песни деда поют и болельщики, и игроки «Факела»
3;Стало известно, какими грибами воронежцы травятся чаще всего
3;«Как «извращенец» поработал с детьми в пяти воронежских школах». Расследование «МОЁ!»
3;«Стоишь и не знаешь: поедет или не поедет». Пассажирка пожаловалась на работу автобусного маршрута Воронеж — Орлово
3;Подробный гороскоп для всех знаков зодиака на пятницу, 5 августа
3;При обстреле посёлка в Брянской области пострадали два человека
3;СМИ: проезд в Воронеже подорожает до 26 рублей
3;Посёлок в Брянской области обстреляли со стороны Украины
3;После пожара на складе «Озона» решается вопрос о компенсации ущерба клиентам
3;Воронежцев снова предупредили о грозе и сильном ветре
3;Нововоронежские атомщики завоевали золото и серебро на отраслевом чемпионате профессионального мастерства «AtomSkills-2022»
4;2 человека погибли и 2 пострадали в ДТП с вылетевшей на встречку иномаркой в Воронежской области
4;Власти Воронежа подали в суд на компанию, обновлявшую подземки на Ворошилова и Волгоградской
4;В Воронеже пенсионер вышел из больницы и пропал без вести
4;Все желающие могут посетить летние кинопарковки, онлайн-парки и лектории Tele2
4;Опасного туберкулёзника принудительно госпитализировали в Воронежской области
4;«Люди ходят по грязи, ноги ломают». Воронежцы пожаловались на разобранный тротуар у ЮВЖД
4;Воронежский участковый ответит в суде за избиение двух человек
4;Влюбленные из Воронежа поженились на крыше строительной площадки жилого комплекса «Бунин»!
4;Найденные в Воронеже останки красноармейца перезахоронят в день, когда бойцу исполнилось бы 100 лет
4;Воронежцы показали всей стране, как надо болеть за любимый «Факел»
4;Обвиняемому в мошенничестве на 9 млн рублей экс-директору Центра кадастровой оценки нашли замену
4;Представители правительства и Заксобрания Ярославской области оценили опыт концессии «РВК-Воронеж»
4;Стало известно, как двое воронежцев убили жительницу Красноярска после изнасилования
4;Как поссорились мэрия и платные парковки в Воронеже
4;Если сбежал хомяк: ищем шустрого беглеца
4;Максимальное количество заболевших ковидом за 3 месяца выявили в Воронежской области
4;ВТБ запустил льготную ипотеку на строительство загородных домов
4;«Пятый киоск в радиусе 50 метров». Воронежцев возмутили внезапно появившиеся напротив школы ларьки
4;В Воронеже стройтехника поломала бордюры и перепахала газон
4;На центральном стадионе Воронежа установили мощное освещение по международному стандарту
4;Улица имени первого главы ДНР появится в Воронеже
4;Директор турфирмы заработала больше миллиона на обмане воронежцев
4;В Воронежской области иномарка вылетела в кювет: есть пострадавший
4;Полицейский выстрелил в агрессивного мужчину в Воронеже
5;КамАЗ и легковушка столкнулись посреди поля в Воронежской области: есть пострадавший
5;Два воронежских завода попали в санкционный список США
5;В Воронеже при пожаре в жилом доме погиб мужчина
5;В Воронеже ищут пропавшую без вести женщину с провалами в памяти
5;Сколько в этом году будет стоить мёд и стоит ли ожидать дефицита этого продукта?
5;«Одним жить, а другим — нет?» Владелец «Доры» рассказал о состоянии брошенных в пакете щенят
5;В Воронеже мужчина охранял «урожай» конопли при помощи собаки
5;4 августа: Мария Магдалина. Почему нельзя много работать в этот день?
5;«Унижение только усугубит ситуацию». Психиатр и сексолог прокомментировали поведение подростка, осквернившего могилы
5;Пять суток без воды сидят жители улицы Брянской в Воронеже
5;Руководитель главного водоканала в одном из южных регионов получил 2 года колонии
5;Скончался щенок, которого жительница Воронежа сбила и бросила в мусорном баке
5;Прогноз погоды в Воронеже на четверг, 4 августа
5;Кто виноват в образовании ямы, в которую в Воронеже провалился автомобиль?
5;Гитарист группы «Сектор Газа» Игорь Кущев: «Я до сих пор жду возвращения Хоя»
5;В Воронеже обнаружили «нанометод» ремонта ям на дороге
5;Александр Гусев рассказал, что Воронежская область может поставлять в Азию
5;Воронежские достопримечательности не вошли в топ-200 самых популярных в стране
5;Подробный гороскоп для всех знаков зодиака на четверг, 4 августа
5;Автомобилистам и маршрутчикам придётся объезжать Петровскую набережную ещё три дня
5;«РВК-Воронеж» оштрафовали на 5 000 рублей из-за аварии, оставившей без воды 43 тысячи горожан
5;«Факел» оштрафовали на 20 тысяч рублей за поведение болельщиков на матче с «Динамо»
5;«Ваши ставки, какая будет траектория падения?» Над остановкой в Воронеже нависли сухие деревья
5;Воронежский депутат попала в список террористов и экстремистов
6;Компанию, экскаватор которой застрял на берегу Усманки, отправят в чёрный список
6;Поисковики Нововоронежской АЭС вернули награды в семьи фронтовиков
6;Полиция заинтересовалась живодёрами, бросившими щенят в завязанном пакете под Воронежем
6;Изменения в Жилищном кодексе РФ: микродоли под запретом
6;Coca-Cola изменит название в России
6;ВТБ выдал более 500 млрд рублей по ипотеке
6;8-летняя девочка пострадала в ДТП с вылетевшей в кювет иномаркой в Воронежской области
6;Новые автобусы с кондиционерами запустят в Воронеже к середине августа
6;Воронежский губернатор: до конца 2023-го качественная питьевая вода будет у 90,5% жителей области
6;Мощный пожар произошёл на складе Ozon
6;«Почему одним строят мегашколы, а другим — сливная яма посреди школьного двора?»
6;Под Воронежем семь щенков бросили в завязанном пакете
6;Грозы, сильный ветер и дожди задержатся в Воронежской области
6;Как мошенники обманывают при покупке домашних питомцев
6;Три грузовика столкнулись на трассе в Воронежской области: есть пострадавший
6;Часть Советского района второй раз за два дня осталась без воды
6;«Сентябрьские довыборы воронежских депутатов». Почему чем меньше избирателей придёт на выборы, тем лучше?
6;В Воронежской области пенсионер на мопеде погиб в ДТП
6;Родители бьют тревогу: в школе под Воронежем нет нормального туалета, столовой и спортзала
6;В Воронеже машина провалилась под землю посреди проезжей части
6;Полёты над Воронежской областью запретили до середины августа
6;Губернатор Воронежской области: «Почти завершили ремонт в Хреновской школе наездников»
6;В Советском районе устранили коммунальную аварию на водоводе
6;Два человека пострадали при пожаре в Железнодорожном районе в Воронеже
7;В Росприроднадзоре взяли пробы из разноцветного затона Воронежского водохранилища
7;Школы в приграничных районах Белгородской области не откроются 1 сентября
7;Правда ли, что в разговоре с мошенниками достаточно одного слова «да», чтобы лишиться своих денег?
7;Почти 30 киосков снесут в Воронеже за август
7;Жительница Воронежа завлекла начинающего бизнесмена в сети афериста
7;3 августа: Онуфрий Молчаливый. Что будет, если много болтать в этот день?
7;Экс-гитарист «Сектора Газа» Игорь Кущев: «Мама спрашивала: «Игорёк, вас за эти песни не посадят?»
7;Облправительство вдвое сократило финансирование фестиваля «Город-сад»
7;Прогноз погоды в Воронеже на среду, 3 августа
7;Из-за ухудшения погоды воронежские энергетики перешли в режим повышенной готовности
7;Воронежские экологи отреагировали на сине-зелёное водохранилище после материала «МОЁ!»
7;Как грамотно помочь пострадавшему пока медики в дороге
7;Из-за вспышки ковида воронежца выписали из больницы и не успели спасти от острой коронарной недостаточности
7;Дрессировщик львов в Воронеже: «Были моменты, когда я думал: всё, конец мне!»
7;Подробный гороскоп для всех знаков зодиака на среду, 3 августа
7;На месте уничтоженного молнией «Тургеневского дуба» появились ростки
7;Часть Советского района осталась без воды из-за крупной аварии
7;Воронежцев удивил бьющий в небо многометровый гейзер посреди города
7;Как научить собаку приносить палку или игрушку
7;Общественный деятель из Воронежа погиб в ходе спецоперации на территории Украины
7;Воронежский предприниматель ответит в суде за то, что полгода не платил сотрудникам
7;В Воронеже задержали 20-летнего расхитителя табачных киосков
7;Мэр Воронежа рассказал, кто продолжит реконструкцию развязки на Остужева
7;«Они ещё долго ждали, что папа выплывет». Воронежец утонул, спасая жизнь сыну и дочке
8;Как растянуть двух цыплят на две недели
8;Воронежцы показали на видео то, что осталось от «Полтинника»
8;Как не встать в пробку на М-4 «Дон» по дороге на море
8;Выдающийся хирург, учёный, родоначальник династии врачей
8;ВЦИОМ: 35% россиян считают, что Солнце вращается вокруг Земли
8;В Нововоронеже стартовал историко-культурный проект Госкорпорации «Росатом»
8;Бывшего главу дирекции ЮВЖД будут судить за злоупотребление полномочиями
8;Где грань между учительской любовью к детям и статьёй за педофилию?
8;«Факел» могут наказать за болельщиков с пиротехникой на матче с «Динамо»
8;На воронежском пляже нашли горы мусора и перекрытый доступ к воде
8;Мэр Воронежа рассказал о кардинальном обновлении новогоднего оформления площади Ленина
8;«Как «извращенец» поработал с детьми в пяти воронежских школах». Расследование «МОЁ!»
8;Пьяный парень ворвался в воронежскую больницу и ударил полицейского
8;Росприроднадзор признал забор на пути к бесплатному пляжу под Воронежем незаконным
8;В Воронеже 18-летние девушки спасли женщину, которую пытался изнасиловать неизвестный
8;В Донбассе функционирует 37 центров гумпомощи партии «Единая Россия»
8;Дожди и грозы надвигаются на Воронежскую область
8;Двое детей пострадали в ДТП с влетевшей в столб иномаркой в Воронежской области
8;В одном из районов Воронежской области ввели карантин из-за африканской чумы свиней
8;Воронежский губернатор держит на контроле ремонт дороги в ЛНР
8;Водитель легковушки погиб в ДТП с грузовиком на воронежской трассе
8;Воронежская прокуратура проверит сообщение о наличии в Дону холерного вибриона
8;Пьяный дебошир подрался со спортсменом за право посетить воронежский бар
8;Получат ли воронежские родители выплаты на детей к школе
9;Пропавшую без вести жительницу Воронежа ищет её семья
9;Не свистеть и не давать в долг. В какие приметы о деньгах верят россияне
9;Воронеж вошёл в топ-10 направлений для бюджетного отдыха в августе
9;2 августа: Ильин день. Время прощания с летом
