page;item_news
34;Мэр Воронежа сообщил о старте торгов на проведение второго этапа реконструкции Остужевской развязки
34;Завкафедрой аграрного университета ужесточили наказание за получение взятки
34;Бывшего воронежского депутата Госдумы Дмитрия Рогозина сняли с должности главы «Роскосмоса»
34;Работники ДСК демонстрируют мастерство на региональном этапе всероссийского конкурса строительных профессий
34;Начальник воронежской Росгвардии ушёл со своего поста
34;2-летняя девочка пострадала в ДТП на воронежской трассе
35;Клиенты Tele2 смогут покупать топливо со скидкой через Яндекс Заправки
35;«Моя дочь больше не хочет рожать даже за огромные деньги»
35;Бывший футболист «Факела» умер в возрасте 29 лет
35;Как котята учатся охоте?
35;30-градусная жара и дожди придут в Воронежскую область на выходных
35;Воронежских автомобилистов приглашают принять участие в увлекательном ралли
35;Воронежанка бросила годовалую дочь на улице, чтобы «найти» ей приёмную семью
35;Где в Воронеже пекут самый вкусный хлеб? Выбор редакции.
35;Воронежский психолог развенчивает самые популярные мифы о гипнозе
35;Инновационную присадку для перекачки нефти представили на международной выставке
35;В Воронеже женщину жёстко сбили на пешеходном переходе (ВИДЕО)
35;Пластиковую бутылку с отравой для сурков нашли в Воронежской области
35;Сбер создаст VR-тренажер для завода «Пигмент»
35;В Воронеже женщина попала в больницу после резкого торможения автобуса
35;Полёты над Воронежской областью запретили в 24-й раз с начала спецоперации
35;Сбежавший из воронежского центра временного содержания украинец выплатит штраф
35;В Воронежской области ищут пропавшего пенсионера с провалами в памяти
35;Пенсионный фонд России объединят с Фондом соцстрахования
35;Какой цвет мочи может свидетельствовать о смертельно опасном заболевании?
35;Село в Брянской области подверглось обстрелу со стороны Украины
35;Что покупали воронежцы в царские времена
35;Самодельное взрывное устройство сбросили на город в Белгородской области
35;«Рядом дети, а эта гадость сливается в реку!» Воронежское водохранилище загрязняется нечистотами
35;15 июля: Берегиня. Зачем девушки шли в лес и кланялись берёзе?
36;Загрязнение и вырубка есть, собственника земель нет. Борьба за озеро и лес на окраине Воронежа продолжается
36;Прогноз погоды в Воронеже на пятницу, 15 июля
36;Украинские беспилотники обстреляли пограничный пост и заправку в Брянской области
36;Мошенника из Воронежа, обманывавшего пенсионеров, задержали в Ростовской области
36;В Воронеже женщина скачала приложение и лишилась 8 тысяч рублей
36;Рабочий упал в шахту и погиб в Воронеже
36;Мэр Воронежа оценил темпы благоустройства Петровской набережной
36;В Воронеже 11-классница не набрала минимальный балл на ЕГЭ по информатике из-за «технического сбоя»
36;Подробный гороскоп для всех знаков зодиака на пятницу, 15 июля
36;Американский хоккейный клуб из НХЛ подписал контракт с воронежским студентом, перенёсшим рак
36;Сколько «криминальной» веревочке ни виться, ФСБ распутает клубок
36;Воронежцы делают ставки на то, сколько простоит полуразрушенный столб на Московском проспекте
36;«Вы будете реагировать или только деньги с нас возьмёте?» Коммунальная река больше двух недель разливается в воронежском микрорайоне
36;Рецепт запоминающегося лета: вкусные завтраки от бренд-шефа и Tele2
36;Зачем Гордума разрешила в Воронеже «уплотнительную» застройку?
36;Журналист Сергей Стиллавин предложил москвичкам равняться на воронежских «чаровниц»
36;«Траст»: на открытых торгах представлены помещения 13 магазинов сети «Лента» в Москве
36;В густонаселённом районе Воронежа нашли останки четырёх красноармейцев
36;Гавриил Троепольский: «Я решил, что писателем быть не смогу»
36;96-летняя пенсионерка поколотила грабителя в Воронежской области
36;«Факел» готовится к большому футболу
36;Воронежские власти прокомментировали слухи о повышении стоимости проезда до 35 рублей
36;Воронежский губернатор поручил сразу же благоустраивать территории в сёлах при расселении аварийного жилфонда
36;Грозы задержатся в Воронежской области
37;«Луна размером с балкон!». Воронежцы сфотографировали «кровавую» луну
37;Нововоронежская АЭС поучаствовала в круглом столе «Жизнь в стиле ЭКО»
37;Мотоциклист сбил ребёнка на велосипеде в Воронежской области
37;Лягушка-рогатка попадёт в ваше сердечко
37;В Воронежской области впервые онлайн зарегистрировали рождение ребёнка
37;Воронежский губернатор одобрил создание в регионе завода по переработке шин
37;Разлагающийся труп пенсионерки нашли в квартире на Машмете
37;«Хозяин дороги в Медовке даже скорую к ребёнку не пустил!»
37;Коллапс переносится. Маршруточники отложили забастовку на выделенках
37;На X Воронежском медиафоруме рассказали о врагах журналистики
37;«Что за ужас на озере в Центральном парке?». Водоём на «Динамо» снова затянуло тиной
37;Жители Воронежа сообщили об избитом до смерти мужчине
37;В воронежском райцентре родители нашли повешенной 14-летнюю дочь
37;Женщина пострадала в столкновении грузовика и легковушек в Воронежской области
37;Воронежцы пожаловались на игнорирующих конечную остановку маршрутчиков
37;Воронежцам сообщили об опасности белой офисной бумаги
37;В Воронеже хозяин квартиры избил своего гостя и сбежал
37;Пожар разгорелся в одном из жилых домов Ленинского района
37;В чём опасность употребления слабоалкогольных напитков летом
37;Почему аварии с водопроводом в Воронеже будут повторяться всё чаще
37;Россиянам сообщили о снижении средней стоимости бензина
37;Более 80% россиян считают себя счастливыми людьми
37;Названы самые высокооплачиваемые вакансии в Воронеже за июль
37;14 июля: Летние Кузьминки. Что можно и чего категорически нельзя сегодня делать
38;На кредитных каникулах воронежцы чаще всего просят об отсрочке платежей
38;Заповедник в Воронежской области частично закрыли из-за высокого уровня пожарной опасности
38;Прогноз погоды в Воронеже на четверг, 14 июля
38;Власти Воронежа вернули дачникам отменённый автобус
38;На трассе М-4 «Дон» начали ремонтировать мост
38;Подробный гороскоп для всех знаков зодиака на четверг, 14 июля
38;«Если уж караси сдохли, то там точно проблема». В пруду под Воронежем умирает рыба
38;Под окнами воронежской многоэтажки нашли тело пенсионера
38;Момент смертельного столкновения «ПАЗика» и иномарки в Воронеже попал на видео
38;Спасатели освободили запертую в ванной воронежанку
38;Водители воронежских маршруток грозятся устроить транспортный коллапс из-за заставленных машинами выделенок
38;Учения на случай появления больных обезьяньей оспой прошли в Воронежской области
38;Пропавший без вести житель Воронежской области вышел на связь с родными
38;Стало известно, куда спешил маршрутчик перед смертельной аварией в Воронеже
38;Я открыл бизнес, а клиентов мало. Что делать?
38;«Когда даёте в долг, берите пример с банков!»
38;Фанаты «Факела» намерены бойкотировать матчи из-за Fan ID
38;Воронежца оштрафовали за плакат с лозунгами, дискредитирующими Вооружённые силы РФ
38;Воронежцев предупредили о граде
38;Как воронежцам вновь оплачивать покупки бесконтактно?
38;Украинец сбежал из воронежского центра временного содержания, чтобы избежать депортации
38;Волонтёры остановили поиски воронежца, пропавшего без вести на юге России
38;Найти семью животным с передержек: регистрируйтесь на выставку-пристройство
38;В «Факеле» рассказали, когда в Воронеже появятся билеты на премьер-лигу
39;Воронежец ударил гаишника кулаком по лицу
39;19-летний водитель мопеда погиб в ДТП с двумя машинами на воронежской трассе
39;Подросток упал с крыши общежития в Воронежской области
39;Грозы и сильный ветер надвигаются на Воронежскую область
39;Новые фишки «SMS-таргета» помогают бизнесу привлекать клиентов
39;Посёлок в Брянской области подвергся артиллерийскому обстрелу
39;Ещё одно ДТП с автобусом заморозило работу двух троллейбусных маршрутов
39;Житель Воронежа пропал без вести во время отдыха в Краснодарском крае
39;Воронежский заповедник поднял плату за вход
39;В Воронеже маршрутка столкнулась с иномаркой и снесла киоск: есть погибший
39;Как летом не набрать лишнего
39;Пять симптомов, которые должны насторожить: как не допустить возникновения меланомы
39;В центре Воронежа разрушили стену «Дома губернатора» при перекладывании плитки
39;Воронежского ветеринара отправили в колонию за взятку
39;Машины не ставить. Воронежцам уродуют автомобили за игнорирование платной парковки на пляже
39;13 июля: День памяти 12 апостолов. Почему сегодня нужно встать пораньше?
39;Центробанк: россияне уверены, что их материальное положение вот-вот начнёт улучшаться
39;Прогноз погоды в Воронеже на среду, 13 июля
39;Из-за аварии с грузовиками на воронежской трассе перекрыли одну из полос в сторону Москвы
39;22-летний парень шантажировал малолетнюю девочку её интимными фото
39;Почему солнце стало опасным в Воронеже?
39;В Воронежской области более 1 500 человек атакованы клещами на начало июля
39;Подробный гороскоп для всех знаков зодиака на среду, 13 июля
39;В Воронеже сотрудник автосервиса угнал «Мерседес» и поехал в гости к родственникам
40;10-километровая пробка из-за 4 аварий сковала трассу на выезде из Воронежа
40;Всплеск заболеваемости ковидом в Воронеже возможен за счёт индийского варианта омикрона
40;Дело жительницы Воронежа, подозреваемой в сожжении тела мужа, вернули правоохранителям
40;Пьяный воронежец украл из школьной столовой котлеты, сосиски и 21 упаковку молока
40;Элитное жильё с водопадом. В подъезде воронежской многоэтажки прошёл ливень
40;Что почитать воронежцам на этой неделе
40;На Воронеж за ночь вылилась половина месячной нормы осадков
40;Почему незаконная перепланировка может оставить хозяев без жилья
40;Вирус, который вызывает рак, – как от него защититься?
40;Камеры ночного видения установят на месте страшного ДТП с двумя автобусами под Воронежем
40;Более 200 единиц оружия пытались пронести за полгода в воронежские суды
40;Советы профи: как выбрать идеальный купальник?
40;Под Воронежем нашли четыре захоронения советских солдат
40;«Мы задыхаемся от дыма!». Жители воронежских сёл пожаловались на незаконную свалку
40;Tele2 запустила технологию VoLTE в Воронежской области
40;Штормовой ветер задержится в Воронежcкой области ещё на один день
40;МВД хочет сажать за пропаганду наркотиков в интернете
40;Вы видели танцующую лошадку?
40;Сбер и «ДСК» запустили программу субсидирования ипотеки
40;Маршрутка сбила воронежца на пешеходном переходе
40;«Зачем вам столько чужих детей?». «Наверное, из-за денег взяли?»
40;«Такси два раза чуть не заглохло из-за потопа на дорогах». Воронежцы рассказали о последствиях вчерашнего ливня
40;В Воронеже ограничат скорость езды на электросамокатах
40;Два человека пострадали в столкновении легковушек на воронежской трассе
41;Первый случай заражения оспой обезьян выявили в России
41;ВТБ: спрос на загородную недвижимость вырос на 50%
41;Из-за отключения света часть Коминтерновского района снова осталась без воды
41;Новогодний парк с каруселями и другие маленькие радости Людмилы Калининой
41;5 вопросов онкологу о безопасном загаре
41;Нововоронежская АЭС организовала практику студентам из Республики Беларусь
41;«А воз и ныне там». Воронежцы возмущены опасной для машин ямой
41;В Воронеже ищут пропавшего без вести уроженца Владимирской области
41;Для кого жара особенно опасна и как её пережить
41;Из России уходит британская косметическая сеть Lush
41;Суд оштрафовал россиянина за использование слова «спецоперация» в кавычках
41;Воронежцев предупредили об опасной водке
41;12 июля: Петров день. Что можно и чего категорически нельзя сегодня делать
41;Аналитики подсчитали, сколько стоит состав «Факела»
41;«Сын не пытался даже ползать!»
41;Прогноз погоды в Воронеже на вторник, 12 июля
41;Вадим Кстенин будет приезжать на стройки без предупреждения
41;Пенсионерка рассказала, как выйти замуж в 79 лет
41;«Виноваты вовсе не вандалы»: воронежцы в очередной раз сообщили о проблемах в парке «Орлёнок»
41;«Будем судиться»: рухнувшее дерево разбило стекло и помяло машину в Воронеже
41;Стало известно, когда численность населения Земли может превысить 8 миллиардов человек
41;Где в Воронеже пекут самый вкусный хлеб? Выбор редакции.
41;Подробный гороскоп для всех знаков зодиака на вторник, 12 июля
41;В Воронеже родственники нашли пропавшего без вести пенсионера
42;После вмешательства МОЁшников на узкой улице установят знаки приоритета
42;«20 главных событий России за 20 лет»: присоединение Крыма
42;В Воронежской области 17-летний водитель «Лады» вылетел с моста: 4 человека пострадали
42;Воронежская область заняла 47-е место в рейтинге регионов по развитию ипотеки
42;Снятие контрольных показаний счетчика электроэнергии проводит ООО «Сервисная компания «Первая линия»
42;На воронежской трассе иномарка врезалась в мопед: погиб мужчина
42;«Всё покосилось, колёс нет». Пушки в Петровском сквере продолжают разрушаться
42;Депутаты Гордумы ждут от воронежцев предложений, как предотвратить кражу канализационных люков
42;«Хорошо, что не на балкон»: огромная берёза рухнула около школы в Воронеже
42;Почти пятикратный рост заболеваемости ковидом зафиксировали в Турции
42;Мемориал в память о погибших в немецком концлагере установили в Воронежской области
42;Стало известно, как 5-летний мальчик выпал из окна дома в Воронежской области
42;Сильный ветер за сутки снёс 30 деревьев в Воронеже
42;Тело утопленника выловили из озера в Воронежской области
42;В Воронеже парень фиктивно прописал в своей однушке 10 иностранцев
42;Стало известно, кто из читателей «МОЁ! Online» получит деньги за лучшие народные новости
42;Каким бывает освещение для аквариума
42;На пяти воронежских пляжах запретили купаться
42;5-летний ребёнок выпал из окна в Воронежской области
42;Доля переводов через СБП среди клиентов ВТБ выросла в 1,5 раза
42;Тело молодого человека нашли в реке в Воронежской области
42;Две легковушки столкнулись лоб в лоб в Воронежской области — один человек погиб
42;СМИ: экс-прокурора из Воронежской области объявили в розыск
42;Грозы и похолодание ждут воронежцев на новой рабочей неделе
43;11-летний мальчик погиб в ДТП с участием электросамоката в Воронежской области
43;Путеводитель по Воронежу: как провести лето в городе и не разочароваться
43;В Воронеже девушка спасла из птичьих лап двух бельчат
43;В Воронежской области вновь продлили запрет на полёты
43;Как защитить сердце в летний период
