page;item_news
60;«Забил источник». Воронежцы сообщили о потоках воды на улицах
60;Появились фото сбитого под Курском украинского беспилотника
60;Из воронежской больницы пропал мужчина с провалами в памяти
60;В рейтинге нищеты воронежцы почти самые богатые
60;Представители узбекской общины организовали канал нелегальной миграции в Воронежской области
60;В реку обрушился мост по дороге на Юго-Западное кладбище
60;29 июня: Тихон Тихий. Что можно и чего категорически нельзя сегодня делать
60;В Воронеже пропала нуждающаяся в медпомощи девочка-подросток
60;Украинский беспилотник сбили под Курском (ВИДЕО)
61;РАССЛЕДОВАНИЕ «МОЁ!» Как лжеволонтёр из Воронежа обирала тяжелобольных детей. Часть II
61;Лжеспасатели продолжают призывать россиян эвакуироваться из-за «обстрелов со стороны Украины»
61;Прогноз погоды в Воронеже на среду, 29 июня
61;«Северный снова без воды»
61;Путин продлил дачную амнистию на 5 лет
61;Почему обрушился купол храма в Воронежской области?
61;Гороскоп для всех знаков зодиака на 29 июня
61;Воронежцев обманули при выплате субсидии на погашение ипотеки
61;Госдума приняла закон против резиновых квартир
61;Что почитать воронежцам на этой неделе
61;Аналитики назвали самые необычные вакансии июня в Воронежской области
61;Водоканал и УК оштрафовали за подтопленный подвал в центре Воронежа
61;«Единая Россия» обеспечит жителей Донбасса русскими учебниками и книгами
61;В Воронеже задержали обманывавшего пенсионеров «полицейского»
61;Отель Holiday Inn продолжит работу в Воронеже под другим именем
61;Сбер в полтора раза увеличил выдачи ипотеки на строительство частных домов
61;Стало известно, кто в Воронеже больше всех перерабатывает
61;Воронежцы шокированы качеством проведенных работ в подземных переходах на Ворошилова и Волгоградской
61;У пляжа в Воронеже сбрасывают сточные воды
61;Чем вызван рост тарифов на коммуналку для воронежцев?
61;Завод «Электроприбор» в Воронеже сносят
61;«Немцы думали — в Воронеже пироги, а тут морду береги»
61;Россошанец ударил знакомого ножом и разбил его машину молотком
61;Мэр Вадим Кстенин: Воронеж закрыл большой коммерческий кредит
62;В Белгороде в диванной битве победила дружба
62;«Думала, его заберут». Мать рассказала, почему бросила новорождённого в лесу под Воронежем
62;В Воронеже продавец отбила деньги у грабителя, который угрожал ей палкой
62;Попугаи — кровожадные охотники
62;Грозы и сильный ветер пришли в Воронежскую область
62;Обвиняемые в убийстве двух детей, что о них известно на  сегодняшний день
62;9-летняя девочка пропала ночью в воронежском селе
62;41 человек остался без еды и воды на воронежской трассе из-за сломавшегося автобуса
62;Небо над Воронежской областью закрыли в 21-й раз с начала спецоперации
62;Уровень пожарной опасности продолжает расти в Воронежской области
62;Два человека пострадали в ДТП с участием «Ауди» на воронежской трассе
62;В Воронеже из-за санкций закрывается отель Holiday Inn
62;В чём причины катастрофического падения рождаемости в Воронежской области
62;Мужчина получил травмы при пожаре в Воронежской области
62;Пропавшего в Воронежской области пенсионера нашли родственники
62;Врач рассказал воронежцам, как пережить жару
62;Серп и молот уже не те. На ВоГРЭСовском мосту выцвела решётка родом из СССР
62;28 июня: Фит-Овсянник. Зачем люди в этот день призывали утопленников?
62;РАССЛЕДОВАНИЕ «МОЁ!»: Как лжеволонтёр из Воронежа обирала тяжелобольных детей. Часть I
62;Жители Белгорода четвёртый день живут на диване
62;Прогноз погоды в Воронеже на вторник, 28 июня
62;У приехавшего с Украины мужчины в руках взорвалась граната
62;В Воронежской области родственники ищут пропавшую без вести пенсионерку
62;Гороскоп для всех знаков зодиака на 28 июня
63;«Только «Кола» кажется разбавленной»: воронежцы оценили меню ресторанов «Вкусно — и точка»
63;Когда окончательно решится вопрос с допуском стадиона «Факела» в премьер-лигу?
63;Часть Ленинского района снова останется без воды
63;Сенатор Сергей Лукин поздравил выпускников воронежских школ
63;Мужчина в одних трусах пропал под Воронежем
63;В Воронеже избили парня за то, что он пел и танцевал на могилах
63;Как не разориться на ремонте в новых реалиях?
63;Воронежцам рассказали, на каких пляжах опасно купаться
63;В Воронеже мужчина сдавал свою квартиру в обмен на наркотики
63;Что воронежцы могут увидеть на фестивале «На родине Пятницкого»
63;Ликвидируют ли последствия безобразного ремонта в переходах на Волгоградской и Ворошилова?
63;«Вы когда-нибудь не пили и не ели три дня?». Воронежцы спасают застрявшую в пластиковой бутылке лису
63;Электронная сигарета разорвала пол-лица 13-летнему школьнику
63;Бывший зампред воронежской Гордумы передумал обжаловать приговор за мошенничество
63;Воронежцы штурмуют бывшие рестораны «Макдоналдс» (ВИДЕО)
63;«Ни постирать, ни приготовить, ни смыть туалет». Жители воронежского села каждое лето остаются без воды
63;Нужны ли Воронежу парковки для собак?
63;30-градусная жара вернётся в Воронеж на рабочей неделе
63;Стало известно, кто из читателей «МОЁ! Online» получит деньги за лучшие народные новости
63;Воронежец погиб от снаряда в ходе спецоперации на Украине
63;Высказавшуюся против спецоперации воронежского депутата Нину Беляеву заочно заключили под стражу
63;Сбер запустил онлайн-викторину к 350-летию со дня рождения Петра I
63;Воронежца, устроившего аварию с погибшими многодетными родителями и ребёнком, ждёт суд
63;В Воронежской области пенсионер ушёл из дома и пропал без вести
64;Водители старых отечественных авто устроили гонку в центре Воронежа
64;17-летний водитель попал в ДТП на воронежской трассе: есть пострадавшие
64;АНО «Образ Будущего» объявил старт отбора инициатив в рамках акции «Родные берега»
64;В Воронежской области огонь уничтожил жилой дом: есть пострадавший
64;Российская армия может начать заключать контракты с выпускниками школ без 3 месяцев срочной службы
64;Мэр  Воронежа и председатель Воронежской городской Думы поздравили горожан с Днем молодежи
64;Ракам нужно контролировать эмоции, а Рыбам — проявить терпение
64;В Воронежской области продолжает сохраняться высокий уровень пожарной опасности
64;Белая смерть в детском питании: где прячется сахар?
64;Воронежские выпускники показали, как быть стильным, и рассказали, как справиться со стрессом
64;Могила Юрия Хоя — причина приехать в Воронеж № 45
64;Восточный гороскоп для всех знаков зодиака на 27 июня
64;«Выпускной прошёл без происшествий»: мэр Воронежа подвёл итоги праздника
64;«На это смотрят дети!» Озеро в Центральном парке покрылось тиной, мусором и мёртвыми животными
64;История цветущего тюльпанового дерева Алексеево-Акатова монастыря
64;Прогноз погоды в Воронеже на понедельник, 27 июня
64;Чем воронежский выпускной-2022 заметно отличился от прошлогодних?
64;Тест. Усы, лапы, хвост!
64;Потасовка двух воронежцев закончилась стрельбой (ВИДЕО)
64;Как в Воронеже прошёл третий общегородской выпускной: ФОТО- и ВИДЕОрепортаж от «МОЁ! Online»
64;Тротуар на проспекте Революции едва не выложили надгробными плитами
64;Пальчиковые игры для малышей
64;«В морозилке котлеты и рулька пропали». Воронежцев второй день подряд оставляют без света
64;В Воронеже столкнулись машина инкассаторов и автобус: есть пострадавший
65;«Я почти год не видела сына, которого муж отнял после развода»
65;Тело пенсионерки нашли под окнами многоэтажки в Воронеже
65;Торжественный выпуск офицеров Военно-воздушной академии прошёл в Воронеже (ФОТО)
65;Подросток утонул в пруду под Воронежем
65;2-летнего ребёнка и двоих взрослых сбили на пешеходном переходе у «Музея-диорамы»
65;Где в Воронеже отключат горячую воду на неделе с 27 июня по 3 июля
65;Несколько воронежцев украли овец и баранов на два миллиона рублей
65;Второй хедлайнер общегородского выпускного: «Математику на ЕГЭ списала»
65;Одним из хедлайнеров общегородского выпускного в Воронеже стал рэпер
65;Общегородской выпускной начался в Воронеже
65;Прогноз погоды в Воронеже на воскресенье, 26 июня
65;Восточный гороскоп для всех знаков зодиака на 26 июня
65;Для «Чернозёма» смонтируют сцену высотой с пятиэтажный дом!
65;Кто позаботится о ваших престарелых родственниках?
65;«Ужасное состояние дома». Воронежцы пожаловались на жуткий вид трёхэтажки в Коминтерновском районе
65;Мать, бросившую новорождённого сына в лесу под Воронежем, задержали
65;Жители нескольких улиц в Железнодорожном районе остались без воды
65;Самосвал перевернулся в карьере в Воронежской области
65;Морпех из Воронежской области погиб в ходе спецоперации на Украине
65;Котёнку с улицы Лизюкова вернули усы
65;Кошачий салон у вас дома: экспресс-линька для котика
65;Два троллейбусных маршрута остановят в Воронеже на неопределённый срок
65;Тело пропавшего без вести мужчины нашли в одном из районов Воронежа
65;Кому грозит штраф за ремонт ванной комнаты
66;Audi вылетела в кювет и перевернулась на трассе Воронеж — Луганск
66;Очень обидно чувствовать себя незащищённой в нашем государстве
66;В рейтинге нищеты воронежцы оказались одними из самых богатых
66;В Воронежской области задержали безработного культиватора конопли
66;Горячо круглый год: как выбрать хороший водонагреватель?
66;Воронежское общество слепых осталось без света
66;Прогноз погоды в Воронеже на субботу, 25 июня
66;Воронежский губернатор гражданам ЛНР: «Мы искренне готовы вам помогать»
66;Воронежец угнал из мастерской отца иномарку и попал на ней в аварию
66;Как изменились цены на продукты за год в Воронеже?
66;Как не попасть под статью о дискредитации Вооруженных сил России
66;Восточный гороскоп для всех знаков зодиака на 25 июня
66;Пенсионера с провалами в памяти нашли на воронежской трассе
66;7-километровая пробка из-за ДТП с горящим грузовиком блокировала выезд из Воронежа
66;Два автомобиля с туристами смыло в Чёрное море в Сочи
66;Полицейские задержали волонтера, который вёз тепловизоры на передовую
66;Михаил Бычков призвал воронежские власти решить вопрос со сроками проведения Платоновского фестиваля
66;Готовим рыбные консервы
66;Водитель Porsche разнёс кирпичный забор в Воронеже и скрылся, бросив машину
66;Новые подробности: в каком порядке возобновляется выпуск LADA
66;Стало известно, в каком состоянии находится брошенный в лесу под Воронежем новорождённый
66;Экс-сотрудники воронежского МЧС отправятся в колонию за взятки
66;Лаундж, диджей и футуристическая фотозона: Tele2 выступит партнером общегородского выпускного в Воронеже
66;«Факел» провёл первый за лето матч с соперником из премьер-лиги
67;«После взрыва газа мы не можем вернуться домой. Наши проблемы никем не решаются»
67;Воронежский полицейский за 1,5 миллиона рублей прекратил поиск подозреваемого в убийстве
67;«Она создала правовой фундамент Воронежа»
67;Осудили иностранца, который забил спящего коллегу бруском в Воронежской области
67;Воронежская передышка: в кукольном театре поставили спектакль о Мандельштаме
67;Cбер и Минэкономразвития усовершенствуют предоставление госуслуг
67;«Мерседес», в котором ехали восемь пассажиров, протаранил здание и загорелся — два человека погибли
67;Как правильно написать заявление родителям для выплат на детей от 8 до 17 лет
67;В воронежском училище выявили нарушения прав обучающихся
67;В Воронежской области в 15-й раз прошел традиционный День поля
67;Синоптики рассказали, когда в Воронеж вернётся жара
67;Велопрогулки с собакой: с чего начать?
67;В Воронежской области начнут подготовку запасов для гражданской обороны
67;Чебурек человеку друг: какой фастфуд любят в Воронеже
67;«Ауди» загорелась в Железнодорожном районе Воронежа (Видео)
67;Где воронежцы могут сэкономить на покупке продуктов и товаров для дома
67;Воронежцы пожаловались на сбои в работе популярных сервисов такси
67;10 автобусных маршрутов изменят в Воронеже
67;Как провести выходные: сходить на бесплатные экскурсии и посмотреть уличную балаган-сказку
67;В Белгороде ночью загорелся военкомат
67;Из-за непогоды в Воронежской области объявлен оранжевый уровень опасности
67;В Воронеже водитель наехал на ногу девушке и скрылся
67;Стало известно, кому из воронежцев повысят зарплаты с 1 июля
67;В Воронеже родственники ищут пропавшего без вести мужчину
68;ВТБ: выдачи ипотеки на новостройки во втором полугодии могут вырасти на треть
68;У жителя Воронежской области изъяли более 650 бутылок незаконного алкоголя
68;4 человека погибли при падении самолёта Ил-76 в Рязани
68;Два воронежца ограбили девушку, угрожая ей пистолетом
68;24 июня: Варнава Земляничник. Что можно и чего категорически нельзя делать в этот день
68;Статистика: санкции Запада пока не выбили воронежские предприятия из колеи
68;Прогноз погоды в Воронеже на пятницу, 24 июня
68;Мужчина пропал без вести с территории воронежского СНТ
68;На юге России отремонтируют популярный у туристов участок трассы М-4 «Дон»
68;Крупный магазин техники начал ввозить смартфоны и игровые приставки без согласия правообладателей
68;Восточный гороскоп для всех знаков зодиака на 24 июня
68;Два десятка домов останутся без воды в Левобережном районе Воронежа
68;Как самому заставить власть отремонтировать подъезд и починить дорогу с помощью мобильника?
68;Пьяная автомобилистка едва не сбила детей в парке в Воронежской области
68;«Клеточка для обезьянок». В Воронеже историческую ограду заменили на «убогий» забор
68;«ЛОС» оштрафовали за сброс стоков в водохранилище на 5,9 млрд рублей
68;Nike полностью уходит с российского рынка
68;Миксуй настроение: Tele2 вместе с экспертом составили летнюю подборку книг
68;Стало известно, какие дни будут выходными в 2023 году
68;Новорожденного ребёнка нашли брошенным в лесу под Воронежем
68;Из России уходит финский производитель красок Tikkurila
68;Финансовая компания «АКСИОМА» представила регион инвесторам в Таджикистане
68;Иномарка сгорела в Коминтерновском районе Воронежа
68;СК раскрыл детали коррупционного дела завкафедрой в ВГТУ
69;На выдаваемые в аренду электросамокаты установят номера
69;«Мы тонем в фекалиях»: жители воронежского общежития пожаловались на ежедневные потопы
69;Специалисты Воронежэнерго обеспечили электроснабжение пенсионера, оставшегося без электричества
69;«Даже олень на зелёный бежит». Продолжение забега воронежского Бэмби сняли на видео
69;Подросток на мотоцикле пострадал в ДТП с «Ладой» в Воронежской области
69;Град обрушится на Воронеж
69;Завкафедрой ВГТУ заподозрили в выдаче липовых диссертаций воронежским налоговикам и чиновникам
